{
  "version": 2,
  "stage": "verifying-and-adapting",
  "artifact_dir": ".praxis/slices/S-001",
  "status": "completed",
  "summary_path": ".praxis/slices/S-001/verification.md",
  "artifacts_written": [
    ".praxis/slices/S-001/verification.md"
  ],
  "route": {
    "kind": "next_slice",
    "next_stage": "clarifying-intent",
    "next_slice_id": "S-002",
    "reason": "Move to the next slice."
  },
  "data": {
    "outcome_code": "next_slice"
  },
  "needs_user_input": false,
  "needs_confirmation": true
}
