{
  "version": 2,
  "stage": "clarifying-intent",
  "artifact_dir": ".praxis/slices/S-001",
  "status": "blocked",
  "summary_path": ".praxis/slices/S-001/spec.md",
  "artifacts_written": [
    ".praxis/slices/S-001/spec.md"
  ],
  "route": {
    "kind": "ask_user",
    "next_stage": null,
    "next_slice_id": null,
    "reason": "Execution mode naming is still ambiguous."
  },
  "data": {
    "outcome_code": "clarification_needed"
  },
  "needs_user_input": true,
  "needs_confirmation": false
}
