{
  "version": 2,
  "stage": "verifying-and-adapting",
  "artifact_dir": ".praxis/slices/S-001",
  "status": "completed",
  "summary_path": ".praxis/slices/S-001/verification.md",
  "artifacts_written": [
    ".praxis/slices/S-001/verification.md"
  ],
  "route": {
    "kind": "done",
    "next_stage": null,
    "next_slice_id": null,
    "reason": "Last slice is complete."
  },
  "data": {
    "outcome_code": "done"
  },
  "needs_user_input": false,
  "needs_confirmation": true
}
